{
  "schema_version": "0.1",
  "created_at": "2026-08-10T00:00:00Z",
  "commit_hash": "5e306f1798e8430d569ec9f8d732c25e5794d9ab",
  "slide": {
    "slide_id": "TCGA-AC-A2QH-01Z-00-DX1",
    "patient_id": "TCGA-AC-A2QH",
    "cohort": "TCGA-BRCA"
  },
  "embedding": {
    "model": "UNI",
    "feature_dim": 1024,
    "n_tiles": 5000,
    "tile_config": {
      "tile_size": 256,
      "target_mpp": 0.5,
      "per_patient_cap": 5000
    },
    "coords_path": "/workspace/data/cache/biop02/brca/coords_v2/TCGA-AC-A2QH-01Z-00-DX1.00B8BFFF-F1E2-4F99-A969-8DD7EE4F8E0B_coords.npy",
    "embedding_path": "/workspace/data/cache/biop02/uni_v1/TCGA-AC-A2QH-01Z-00-DX1.00B8BFFF-F1E2-4F99-A969-8DD7EE4F8E0B_uni_embeddings.npy"
  },
  "phenotype": {
    "model": "SlideMLP/CLAM-SB (BIOP02-39/46/53, uni_v2)",
    "predictions": {
      "er_status": { "prob_positive": 0.366833, "predicted_label": 0 },
      "pr_status":  { "prob_positive": 0.472934, "predicted_label": 0 },
      "her2_status":{ "prob_positive": 0.134163, "predicted_label": 0 },
      "pam50": {
        "LumA": 0.044497,
        "LumB": 0.072925,
        "Basal": 0.792546,
        "HER2E": 0.063493,
        "Normal": 0.026539
      }
    }
  },
  "hypothesis": [
    {
      "rank": 1,
      "drug_class": "Cytotoxic chemotherapy (taxane/anthracycline backbone)",
      "rationale": "Triple-negative 표현형(ER-/PR-/HER2-)은 표적 호르몬/HER2 경로가 없어 세포독성 화학요법이 표준 backbone으로 고려됨. BRCA 세포주 일관성 분석: ρ=0.4682 (3개 매칭). ICI 계열은 본 프로젝트 범위에서 명시적으로 제외. (hypothesis_only — BIOP02-60 v1.0)",
      "confidence": 0.5682,
      "data_source": "both",
      "supporting_endpoints": ["er_status", "pr_status", "her2_status"]
    }
  ],
  "claim_level": "hypothesis_only",
  "critic_status": "pending",
  "confidence_source": "measured_rho",
  "generated_by": "jhans",
  "critic_5_biological_plausibility": {
    "status": "pending",
    "forbidden_phrase_violations": [],
    "direction_consistency_issues": [],
    "note": "슬라이드 교체(TCGA-OL-A5RU→TCGA-AC-A2QH) 및 스키마 교정(BIOP02-116)으로 재검증 대기. endocrine_rule.py v1.0 (BIOP02-60)."
  }
}
